No.     Time           Source                Destination           Protocol Length Info
   1943 845.536105070  127.0.0.1             127.0.0.1             TCP      74     46960 → 8004 [SYN] Seq=0 Win=65495 Len=0 MSS=65495 SACK_PERM=1 TSval=4128053137 TSecr=0 WS=128

Frame 1943: 74 bytes on wire (592 bits), 74 bytes captured (592 bits) on interface lo, id 0
Ethernet II, Src: 00:00:00_00:00:00 (00:00:00:00:00:00), Dst: 00:00:00_00:00:00 (00:00:00:00:00:00)
Internet Protocol Version 4, Src: 127.0.0.1, Dst: 127.0.0.1
Transmission Control Protocol, Src Port: 46960, Dst Port: 8004, Seq: 0, Len: 0

No.     Time           Source                Destination           Protocol Length Info
   1944 845.536125454  127.0.0.1             127.0.0.1             TCP      74     8004 → 46960 [SYN, ACK] Seq=0 Ack=1 Win=65483 Len=0 MSS=65495 SACK_PERM=1 TSval=4128053138 TSecr=4128053137 WS=128

Frame 1944: 74 bytes on wire (592 bits), 74 bytes captured (592 bits) on interface lo, id 0
Ethernet II, Src: 00:00:00_00:00:00 (00:00:00:00:00:00), Dst: 00:00:00_00:00:00 (00:00:00:00:00:00)
Internet Protocol Version 4, Src: 127.0.0.1, Dst: 127.0.0.1
Transmission Control Protocol, Src Port: 8004, Dst Port: 46960, Seq: 0, Ack: 1, Len: 0

No.     Time           Source                Destination           Protocol Length Info
   1945 845.536144314  127.0.0.1             127.0.0.1             TCP      66     46960 → 8004 [ACK] Seq=1 Ack=1 Win=65536 Len=0 TSval=4128053138 TSecr=4128053138

Frame 1945: 66 bytes on wire (528 bits), 66 bytes captured (528 bits) on interface lo, id 0
Ethernet II, Src: 00:00:00_00:00:00 (00:00:00:00:00:00), Dst: 00:00:00_00:00:00 (00:00:00:00:00:00)
Internet Protocol Version 4, Src: 127.0.0.1, Dst: 127.0.0.1
Transmission Control Protocol, Src Port: 46960, Dst Port: 8004, Seq: 1, Ack: 1, Len: 0

No.     Time           Source                Destination           Protocol Length Info
   1946 845.536470713  127.0.0.1             127.0.0.1             TLSv1.3  583    Client Hello

Frame 1946: 583 bytes on wire (4664 bits), 583 bytes captured (4664 bits) on interface lo, id 0
Ethernet II, Src: 00:00:00_00:00:00 (00:00:00:00:00:00), Dst: 00:00:00_00:00:00 (00:00:00:00:00:00)
Internet Protocol Version 4, Src: 127.0.0.1, Dst: 127.0.0.1
Transmission Control Protocol, Src Port: 46960, Dst Port: 8004, Seq: 1, Ack: 1, Len: 517
Transport Layer Security
    TLSv1.3 Record Layer: Handshake Protocol: Client Hello
        Content Type: Handshake (22)
        Version: TLS 1.0 (0x0301)
        Length: 512
        Handshake Protocol: Client Hello

No.     Time           Source                Destination           Protocol Length Info
   1947 845.536480176  127.0.0.1             127.0.0.1             TCP      66     8004 → 46960 [ACK] Seq=1 Ack=518 Win=65024 Len=0 TSval=4128053138 TSecr=4128053138

Frame 1947: 66 bytes on wire (528 bits), 66 bytes captured (528 bits) on interface lo, id 0
Ethernet II, Src: 00:00:00_00:00:00 (00:00:00:00:00:00), Dst: 00:00:00_00:00:00 (00:00:00:00:00:00)
Internet Protocol Version 4, Src: 127.0.0.1, Dst: 127.0.0.1
Transmission Control Protocol, Src Port: 8004, Dst Port: 46960, Seq: 1, Ack: 518, Len: 0

No.     Time           Source                Destination           Protocol Length Info
   1948 845.539723002  127.0.0.1             127.0.0.1             TLSv1.3  1645   Server Hello, Change Cipher Spec, Application Data, Application Data, Application Data, Application Data

Frame 1948: 1645 bytes on wire (13160 bits), 1645 bytes captured (13160 bits) on interface lo, id 0
Ethernet II, Src: 00:00:00_00:00:00 (00:00:00:00:00:00), Dst: 00:00:00_00:00:00 (00:00:00:00:00:00)
Internet Protocol Version 4, Src: 127.0.0.1, Dst: 127.0.0.1
Transmission Control Protocol, Src Port: 8004, Dst Port: 46960, Seq: 1, Ack: 518, Len: 1579
Transport Layer Security
    TLSv1.3 Record Layer: Handshake Protocol: Server Hello
        Content Type: Handshake (22)
        Version: TLS 1.2 (0x0303)
        Length: 122
        Handshake Protocol: Server Hello
    TLSv1.3 Record Layer: Change Cipher Spec Protocol: Change Cipher Spec
        Content Type: Change Cipher Spec (20)
        Version: TLS 1.2 (0x0303)
        Length: 1
        Change Cipher Spec Message
    TLSv1.3 Record Layer: Application Data Protocol: Application Data
        Opaque Type: Application Data (23)
        Version: TLS 1.2 (0x0303)
        Length: 23
        Encrypted Application Data: a71dca8a64c37793e06333f22bf9f99f181b8a888990ab
    TLSv1.3 Record Layer: Application Data Protocol: Application Data
        Opaque Type: Application Data (23)
        Version: TLS 1.2 (0x0303)
        Length: 1053
        Encrypted Application Data: 01d132b003f00bdfb586287b0ad90905eade0c7d73d0920d…
    TLSv1.3 Record Layer: Application Data Protocol: Application Data
        Opaque Type: Application Data (23)
        Version: TLS 1.2 (0x0303)
        Length: 281
        Encrypted Application Data: 8be69c6a8641d22789d8ad5c4b7dd34a97ddeb65a0b9ef79…
    TLSv1.3 Record Layer: Application Data Protocol: Application Data
        Opaque Type: Application Data (23)
        Version: TLS 1.2 (0x0303)
        Length: 69
        Encrypted Application Data: 87d2e168a9a5dea55119c9f3f3ca1312970ef419bb657b64…

No.     Time           Source                Destination           Protocol Length Info
   1949 845.539737994  127.0.0.1             127.0.0.1             TCP      66     46960 → 8004 [ACK] Seq=518 Ack=1580 Win=64128 Len=0 TSval=4128053141 TSecr=4128053141

Frame 1949: 66 bytes on wire (528 bits), 66 bytes captured (528 bits) on interface lo, id 0
Ethernet II, Src: 00:00:00_00:00:00 (00:00:00:00:00:00), Dst: 00:00:00_00:00:00 (00:00:00:00:00:00)
Internet Protocol Version 4, Src: 127.0.0.1, Dst: 127.0.0.1
Transmission Control Protocol, Src Port: 46960, Dst Port: 8004, Seq: 518, Ack: 1580, Len: 0

No.     Time           Source                Destination           Protocol Length Info
   1950 845.540380371  127.0.0.1             127.0.0.1             TLSv1.3  146    Change Cipher Spec, Application Data

Frame 1950: 146 bytes on wire (1168 bits), 146 bytes captured (1168 bits) on interface lo, id 0
Ethernet II, Src: 00:00:00_00:00:00 (00:00:00:00:00:00), Dst: 00:00:00_00:00:00 (00:00:00:00:00:00)
Internet Protocol Version 4, Src: 127.0.0.1, Dst: 127.0.0.1
Transmission Control Protocol, Src Port: 46960, Dst Port: 8004, Seq: 518, Ack: 1580, Len: 80
Transport Layer Security
    TLSv1.3 Record Layer: Change Cipher Spec Protocol: Change Cipher Spec
        Content Type: Change Cipher Spec (20)
        Version: TLS 1.2 (0x0303)
        Length: 1
        Change Cipher Spec Message
    TLSv1.3 Record Layer: Application Data Protocol: Application Data
        Opaque Type: Application Data (23)
        Version: TLS 1.2 (0x0303)
        Length: 69
        Encrypted Application Data: 980c985d5483bc1e1eaa5ee678e6ff8e2c9d062b31bb2b11…

No.     Time           Source                Destination           Protocol Length Info
   1951 845.540589735  127.0.0.1             127.0.0.1             TLSv1.3  321    Application Data

Frame 1951: 321 bytes on wire (2568 bits), 321 bytes captured (2568 bits) on interface lo, id 0
Ethernet II, Src: 00:00:00_00:00:00 (00:00:00:00:00:00), Dst: 00:00:00_00:00:00 (00:00:00:00:00:00)
Internet Protocol Version 4, Src: 127.0.0.1, Dst: 127.0.0.1
Transmission Control Protocol, Src Port: 8004, Dst Port: 46960, Seq: 1580, Ack: 598, Len: 255
Transport Layer Security
    TLSv1.3 Record Layer: Application Data Protocol: Application Data
        Opaque Type: Application Data (23)
        Version: TLS 1.2 (0x0303)
        Length: 250
        Encrypted Application Data: 2fa81290c5b3158835ab96e67e4b4836eb5320c756b7f399…

No.     Time           Source                Destination           Protocol Length Info
   1952 845.582897505  127.0.0.1             127.0.0.1             TCP      66     46960 → 8004 [ACK] Seq=598 Ack=1835 Win=65408 Len=0 TSval=4128053184 TSecr=4128053142

Frame 1952: 66 bytes on wire (528 bits), 66 bytes captured (528 bits) on interface lo, id 0
Ethernet II, Src: 00:00:00_00:00:00 (00:00:00:00:00:00), Dst: 00:00:00_00:00:00 (00:00:00:00:00:00)
Internet Protocol Version 4, Src: 127.0.0.1, Dst: 127.0.0.1
Transmission Control Protocol, Src Port: 46960, Dst Port: 8004, Seq: 598, Ack: 1835, Len: 0

No.     Time           Source                Destination           Protocol Length Info
   1953 845.582921267  127.0.0.1             127.0.0.1             TLSv1.3  321    Application Data

Frame 1953: 321 bytes on wire (2568 bits), 321 bytes captured (2568 bits) on interface lo, id 0
Ethernet II, Src: 00:00:00_00:00:00 (00:00:00:00:00:00), Dst: 00:00:00_00:00:00 (00:00:00:00:00:00)
Internet Protocol Version 4, Src: 127.0.0.1, Dst: 127.0.0.1
Transmission Control Protocol, Src Port: 8004, Dst Port: 46960, Seq: 1835, Ack: 598, Len: 255
Transport Layer Security
    TLSv1.3 Record Layer: Application Data Protocol: Application Data
        Opaque Type: Application Data (23)
        Version: TLS 1.2 (0x0303)
        Length: 250
        Encrypted Application Data: 854092086088593d0825ff4b6e3b6ce35359f599bc8b3e17…

No.     Time           Source                Destination           Protocol Length Info
   1954 845.582928239  127.0.0.1             127.0.0.1             TCP      66     46960 → 8004 [ACK] Seq=598 Ack=2090 Win=65280 Len=0 TSval=4128053184 TSecr=4128053184

Frame 1954: 66 bytes on wire (528 bits), 66 bytes captured (528 bits) on interface lo, id 0
Ethernet II, Src: 00:00:00_00:00:00 (00:00:00:00:00:00), Dst: 00:00:00_00:00:00 (00:00:00:00:00:00)
Internet Protocol Version 4, Src: 127.0.0.1, Dst: 127.0.0.1
Transmission Control Protocol, Src Port: 46960, Dst Port: 8004, Seq: 598, Ack: 2090, Len: 0

No.     Time           Source                Destination           Protocol Length Info
   2060 893.168563670  127.0.0.1             127.0.0.1             TLSv1.3  89     Application Data

Frame 2060: 89 bytes on wire (712 bits), 89 bytes captured (712 bits) on interface lo, id 0
Ethernet II, Src: 00:00:00_00:00:00 (00:00:00:00:00:00), Dst: 00:00:00_00:00:00 (00:00:00:00:00:00)
Internet Protocol Version 4, Src: 127.0.0.1, Dst: 127.0.0.1
Transmission Control Protocol, Src Port: 46960, Dst Port: 8004, Seq: 598, Ack: 2090, Len: 23
Transport Layer Security
    TLSv1.3 Record Layer: Application Data Protocol: Application Data
        Opaque Type: Application Data (23)
        Version: TLS 1.2 (0x0303)
        Length: 18
        Encrypted Application Data: adde086084fb40213cc9d867bac17068a5d1

No.     Time           Source                Destination           Protocol Length Info
   2061 893.168863191  127.0.0.1             127.0.0.1             TLSv1.3  445    Application Data

Frame 2061: 445 bytes on wire (3560 bits), 445 bytes captured (3560 bits) on interface lo, id 0
Ethernet II, Src: 00:00:00_00:00:00 (00:00:00:00:00:00), Dst: 00:00:00_00:00:00 (00:00:00:00:00:00)
Internet Protocol Version 4, Src: 127.0.0.1, Dst: 127.0.0.1
Transmission Control Protocol, Src Port: 8004, Dst Port: 46960, Seq: 2090, Ack: 621, Len: 379
Transport Layer Security
    TLSv1.3 Record Layer: Application Data Protocol: Application Data
        Opaque Type: Application Data (23)
        Version: TLS 1.2 (0x0303)
        Length: 374
        Encrypted Application Data: 909f9e22bb7a75b8e50cb10f98fb19f37ca5c5751d95782d…

No.     Time           Source                Destination           Protocol Length Info
   2062 893.168875003  127.0.0.1             127.0.0.1             TCP      66     46960 → 8004 [ACK] Seq=621 Ack=2469 Win=65024 Len=0 TSval=4128100770 TSecr=4128100770

Frame 2062: 66 bytes on wire (528 bits), 66 bytes captured (528 bits) on interface lo, id 0
Ethernet II, Src: 00:00:00_00:00:00 (00:00:00:00:00:00), Dst: 00:00:00_00:00:00 (00:00:00:00:00:00)
Internet Protocol Version 4, Src: 127.0.0.1, Dst: 127.0.0.1
Transmission Control Protocol, Src Port: 46960, Dst Port: 8004, Seq: 621, Ack: 2469, Len: 0

No.     Time           Source                Destination           Protocol Length Info
   2111 914.452986832  127.0.0.1             127.0.0.1             TLSv1.3  89     Application Data

Frame 2111: 89 bytes on wire (712 bits), 89 bytes captured (712 bits) on interface lo, id 0
Ethernet II, Src: 00:00:00_00:00:00 (00:00:00:00:00:00), Dst: 00:00:00_00:00:00 (00:00:00:00:00:00)
Internet Protocol Version 4, Src: 127.0.0.1, Dst: 127.0.0.1
Transmission Control Protocol, Src Port: 46960, Dst Port: 8004, Seq: 621, Ack: 2469, Len: 23
Transport Layer Security
    TLSv1.3 Record Layer: Application Data Protocol: Application Data
        Opaque Type: Application Data (23)
        Version: TLS 1.2 (0x0303)
        Length: 18
        Encrypted Application Data: 68d028d1ff74230d37bbec1f4f60d5ad871b

No.     Time           Source                Destination           Protocol Length Info
   2112 914.453128779  127.0.0.1             127.0.0.1             TLSv1.3  107    Application Data

Frame 2112: 107 bytes on wire (856 bits), 107 bytes captured (856 bits) on interface lo, id 0
Ethernet II, Src: 00:00:00_00:00:00 (00:00:00:00:00:00), Dst: 00:00:00_00:00:00 (00:00:00:00:00:00)
Internet Protocol Version 4, Src: 127.0.0.1, Dst: 127.0.0.1
Transmission Control Protocol, Src Port: 8004, Dst Port: 46960, Seq: 2469, Ack: 644, Len: 41
Transport Layer Security
    TLSv1.3 Record Layer: Application Data Protocol: Application Data
        Opaque Type: Application Data (23)
        Version: TLS 1.2 (0x0303)
        Length: 36
        Encrypted Application Data: 3a34eabd4e44281c8333018d5baa9b9ee3234c96cb2b5299…

No.     Time           Source                Destination           Protocol Length Info
   2113 914.453136064  127.0.0.1             127.0.0.1             TCP      66     46960 → 8004 [ACK] Seq=644 Ack=2510 Win=65536 Len=0 TSval=4128122055 TSecr=4128122055

Frame 2113: 66 bytes on wire (528 bits), 66 bytes captured (528 bits) on interface lo, id 0
Ethernet II, Src: 00:00:00_00:00:00 (00:00:00:00:00:00), Dst: 00:00:00_00:00:00 (00:00:00:00:00:00)
Internet Protocol Version 4, Src: 127.0.0.1, Dst: 127.0.0.1
Transmission Control Protocol, Src Port: 46960, Dst Port: 8004, Seq: 644, Ack: 2510, Len: 0

No.     Time           Source                Destination           Protocol Length Info
   2150 937.956984988  127.0.0.1             127.0.0.1             TLSv1.3  93     Application Data

Frame 2150: 93 bytes on wire (744 bits), 93 bytes captured (744 bits) on interface lo, id 0
Ethernet II, Src: 00:00:00_00:00:00 (00:00:00:00:00:00), Dst: 00:00:00_00:00:00 (00:00:00:00:00:00)
Internet Protocol Version 4, Src: 127.0.0.1, Dst: 127.0.0.1
Transmission Control Protocol, Src Port: 46960, Dst Port: 8004, Seq: 644, Ack: 2510, Len: 27
Transport Layer Security
    TLSv1.3 Record Layer: Application Data Protocol: Application Data
        Opaque Type: Application Data (23)
        Version: TLS 1.2 (0x0303)
        Length: 22
        Encrypted Application Data: 33147b97ed5adbf2ee11d281cf67072d2159acb0a95b

No.     Time           Source                Destination           Protocol Length Info
   2151 937.957295633  127.0.0.1             127.0.0.1             TLSv1.3  112    Application Data

Frame 2151: 112 bytes on wire (896 bits), 112 bytes captured (896 bits) on interface lo, id 0
Ethernet II, Src: 00:00:00_00:00:00 (00:00:00:00:00:00), Dst: 00:00:00_00:00:00 (00:00:00:00:00:00)
Internet Protocol Version 4, Src: 127.0.0.1, Dst: 127.0.0.1
Transmission Control Protocol, Src Port: 8004, Dst Port: 46960, Seq: 2510, Ack: 671, Len: 46
Transport Layer Security
    TLSv1.3 Record Layer: Application Data Protocol: Application Data
        Opaque Type: Application Data (23)
        Version: TLS 1.2 (0x0303)
        Length: 41
        Encrypted Application Data: caa651662dd32f840b2381d7e8d345d26d89dad5af6b2326…

No.     Time           Source                Destination           Protocol Length Info
   2152 937.957311810  127.0.0.1             127.0.0.1             TCP      66     46960 → 8004 [ACK] Seq=671 Ack=2556 Win=65536 Len=0 TSval=4128145559 TSecr=4128145559

Frame 2152: 66 bytes on wire (528 bits), 66 bytes captured (528 bits) on interface lo, id 0
Ethernet II, Src: 00:00:00_00:00:00 (00:00:00:00:00:00), Dst: 00:00:00_00:00:00 (00:00:00:00:00:00)
Internet Protocol Version 4, Src: 127.0.0.1, Dst: 127.0.0.1
Transmission Control Protocol, Src Port: 46960, Dst Port: 8004, Seq: 671, Ack: 2556, Len: 0

No.     Time           Source                Destination           Protocol Length Info
   2161 945.009327662  127.0.0.1             127.0.0.1             TLSv1.3  89     Application Data

Frame 2161: 89 bytes on wire (712 bits), 89 bytes captured (712 bits) on interface lo, id 0
Ethernet II, Src: 00:00:00_00:00:00 (00:00:00:00:00:00), Dst: 00:00:00_00:00:00 (00:00:00:00:00:00)
Internet Protocol Version 4, Src: 127.0.0.1, Dst: 127.0.0.1
Transmission Control Protocol, Src Port: 46960, Dst Port: 8004, Seq: 671, Ack: 2556, Len: 23
Transport Layer Security
    TLSv1.3 Record Layer: Application Data Protocol: Application Data
        Opaque Type: Application Data (23)
        Version: TLS 1.2 (0x0303)
        Length: 18
        Encrypted Application Data: 8ee9d212945742c9288b6ca43046d32c4dc3

No.     Time           Source                Destination           Protocol Length Info
   2162 945.009474197  127.0.0.1             127.0.0.1             TLSv1.3  107    Application Data

Frame 2162: 107 bytes on wire (856 bits), 107 bytes captured (856 bits) on interface lo, id 0
Ethernet II, Src: 00:00:00_00:00:00 (00:00:00:00:00:00), Dst: 00:00:00_00:00:00 (00:00:00:00:00:00)
Internet Protocol Version 4, Src: 127.0.0.1, Dst: 127.0.0.1
Transmission Control Protocol, Src Port: 8004, Dst Port: 46960, Seq: 2556, Ack: 694, Len: 41
Transport Layer Security
    TLSv1.3 Record Layer: Application Data Protocol: Application Data
        Opaque Type: Application Data (23)
        Version: TLS 1.2 (0x0303)
        Length: 36
        Encrypted Application Data: 02e01122d44dd4b9c290af0ec63502495aaf5acfc36e5ebb…

No.     Time           Source                Destination           Protocol Length Info
   2163 945.009484242  127.0.0.1             127.0.0.1             TCP      66     46960 → 8004 [ACK] Seq=694 Ack=2597 Win=65536 Len=0 TSval=4128152611 TSecr=4128152611

Frame 2163: 66 bytes on wire (528 bits), 66 bytes captured (528 bits) on interface lo, id 0
Ethernet II, Src: 00:00:00_00:00:00 (00:00:00:00:00:00), Dst: 00:00:00_00:00:00 (00:00:00:00:00:00)
Internet Protocol Version 4, Src: 127.0.0.1, Dst: 127.0.0.1
Transmission Control Protocol, Src Port: 46960, Dst Port: 8004, Seq: 694, Ack: 2597, Len: 0

No.     Time           Source                Destination           Protocol Length Info
   2184 950.433382207  127.0.0.1             127.0.0.1             TLSv1.3  91     Application Data

Frame 2184: 91 bytes on wire (728 bits), 91 bytes captured (728 bits) on interface lo, id 0
Ethernet II, Src: 00:00:00_00:00:00 (00:00:00:00:00:00), Dst: 00:00:00_00:00:00 (00:00:00:00:00:00)
Internet Protocol Version 4, Src: 127.0.0.1, Dst: 127.0.0.1
Transmission Control Protocol, Src Port: 46960, Dst Port: 8004, Seq: 694, Ack: 2597, Len: 25
Transport Layer Security
    TLSv1.3 Record Layer: Application Data Protocol: Application Data
        Opaque Type: Application Data (23)
        Version: TLS 1.2 (0x0303)
        Length: 20
        Encrypted Application Data: 24371c1411712c399eef40c3b99bc8b1bfef77aa

No.     Time           Source                Destination           Protocol Length Info
   2185 950.433526759  127.0.0.1             127.0.0.1             TLSv1.3  108    Application Data

Frame 2185: 108 bytes on wire (864 bits), 108 bytes captured (864 bits) on interface lo, id 0
Ethernet II, Src: 00:00:00_00:00:00 (00:00:00:00:00:00), Dst: 00:00:00_00:00:00 (00:00:00:00:00:00)
Internet Protocol Version 4, Src: 127.0.0.1, Dst: 127.0.0.1
Transmission Control Protocol, Src Port: 8004, Dst Port: 46960, Seq: 2597, Ack: 719, Len: 42
Transport Layer Security
    TLSv1.3 Record Layer: Application Data Protocol: Application Data
        Opaque Type: Application Data (23)
        Version: TLS 1.2 (0x0303)
        Length: 37
        Encrypted Application Data: 432de226d2d19a567b84aafe9eb6c90570068dc7a3cd22cc…

No.     Time           Source                Destination           Protocol Length Info
   2186 950.433535341  127.0.0.1             127.0.0.1             TCP      66     46960 → 8004 [ACK] Seq=719 Ack=2639 Win=65536 Len=0 TSval=4128158035 TSecr=4128158035

Frame 2186: 66 bytes on wire (528 bits), 66 bytes captured (528 bits) on interface lo, id 0
Ethernet II, Src: 00:00:00_00:00:00 (00:00:00:00:00:00), Dst: 00:00:00_00:00:00 (00:00:00:00:00:00)
Internet Protocol Version 4, Src: 127.0.0.1, Dst: 127.0.0.1
Transmission Control Protocol, Src Port: 46960, Dst Port: 8004, Seq: 719, Ack: 2639, Len: 0

No.     Time           Source                Destination           Protocol Length Info
   2203 958.209429084  127.0.0.1             127.0.0.1             TLSv1.3  100    Application Data

Frame 2203: 100 bytes on wire (800 bits), 100 bytes captured (800 bits) on interface lo, id 0
Ethernet II, Src: 00:00:00_00:00:00 (00:00:00:00:00:00), Dst: 00:00:00_00:00:00 (00:00:00:00:00:00)
Internet Protocol Version 4, Src: 127.0.0.1, Dst: 127.0.0.1
Transmission Control Protocol, Src Port: 46960, Dst Port: 8004, Seq: 719, Ack: 2639, Len: 34
Transport Layer Security
    TLSv1.3 Record Layer: Application Data Protocol: Application Data
        Opaque Type: Application Data (23)
        Version: TLS 1.2 (0x0303)
        Length: 29
        Encrypted Application Data: f9ecb128293311454f9eece424b9828ceebd0a0f0940f1b6…

No.     Time           Source                Destination           Protocol Length Info
   2204 958.209581856  127.0.0.1             127.0.0.1             TLSv1.3  128    Application Data

Frame 2204: 128 bytes on wire (1024 bits), 128 bytes captured (1024 bits) on interface lo, id 0
Ethernet II, Src: 00:00:00_00:00:00 (00:00:00:00:00:00), Dst: 00:00:00_00:00:00 (00:00:00:00:00:00)
Internet Protocol Version 4, Src: 127.0.0.1, Dst: 127.0.0.1
Transmission Control Protocol, Src Port: 8004, Dst Port: 46960, Seq: 2639, Ack: 753, Len: 62
Transport Layer Security
    TLSv1.3 Record Layer: Application Data Protocol: Application Data
        Opaque Type: Application Data (23)
        Version: TLS 1.2 (0x0303)
        Length: 57
        Encrypted Application Data: bec6fb14c4aeda803f95ce64717806b99859fa6d9b0bf00f…

No.     Time           Source                Destination           Protocol Length Info
   2205 958.209587903  127.0.0.1             127.0.0.1             TCP      66     46960 → 8004 [ACK] Seq=753 Ack=2701 Win=65536 Len=0 TSval=4128165811 TSecr=4128165811

Frame 2205: 66 bytes on wire (528 bits), 66 bytes captured (528 bits) on interface lo, id 0
Ethernet II, Src: 00:00:00_00:00:00 (00:00:00:00:00:00), Dst: 00:00:00_00:00:00 (00:00:00:00:00:00)
Internet Protocol Version 4, Src: 127.0.0.1, Dst: 127.0.0.1
Transmission Control Protocol, Src Port: 46960, Dst Port: 8004, Seq: 753, Ack: 2701, Len: 0

No.     Time           Source                Destination           Protocol Length Info
   2274 996.577693525  127.0.0.1             127.0.0.1             TLSv1.3  89     Application Data

Frame 2274: 89 bytes on wire (712 bits), 89 bytes captured (712 bits) on interface lo, id 0
Ethernet II, Src: 00:00:00_00:00:00 (00:00:00:00:00:00), Dst: 00:00:00_00:00:00 (00:00:00:00:00:00)
Internet Protocol Version 4, Src: 127.0.0.1, Dst: 127.0.0.1
Transmission Control Protocol, Src Port: 46960, Dst Port: 8004, Seq: 753, Ack: 2701, Len: 23
Transport Layer Security
    TLSv1.3 Record Layer: Application Data Protocol: Application Data
        Opaque Type: Application Data (23)
        Version: TLS 1.2 (0x0303)
        Length: 18
        Encrypted Application Data: 7b129828705bfcaada60a942f7b9d3417cbb

No.     Time           Source                Destination           Protocol Length Info
   2275 996.577828653  127.0.0.1             127.0.0.1             TLSv1.3  109    Application Data

Frame 2275: 109 bytes on wire (872 bits), 109 bytes captured (872 bits) on interface lo, id 0
Ethernet II, Src: 00:00:00_00:00:00 (00:00:00:00:00:00), Dst: 00:00:00_00:00:00 (00:00:00:00:00:00)
Internet Protocol Version 4, Src: 127.0.0.1, Dst: 127.0.0.1
Transmission Control Protocol, Src Port: 8004, Dst Port: 46960, Seq: 2701, Ack: 776, Len: 43
Transport Layer Security
    TLSv1.3 Record Layer: Application Data Protocol: Application Data
        Opaque Type: Application Data (23)
        Version: TLS 1.2 (0x0303)
        Length: 38
        Encrypted Application Data: 524408b4b3294f25a39eec767a642269a4c4138e77f3d300…

No.     Time           Source                Destination           Protocol Length Info
   2276 996.577835807  127.0.0.1             127.0.0.1             TCP      66     46960 → 8004 [ACK] Seq=776 Ack=2744 Win=65536 Len=0 TSval=4128204179 TSecr=4128204179

Frame 2276: 66 bytes on wire (528 bits), 66 bytes captured (528 bits) on interface lo, id 0
Ethernet II, Src: 00:00:00_00:00:00 (00:00:00:00:00:00), Dst: 00:00:00_00:00:00 (00:00:00:00:00:00)
Internet Protocol Version 4, Src: 127.0.0.1, Dst: 127.0.0.1
Transmission Control Protocol, Src Port: 46960, Dst Port: 8004, Seq: 776, Ack: 2744, Len: 0

No.     Time           Source                Destination           Protocol Length Info
   2285 1005.520750924 127.0.0.1             127.0.0.1             TLSv1.3  93     Application Data

Frame 2285: 93 bytes on wire (744 bits), 93 bytes captured (744 bits) on interface lo, id 0
Ethernet II, Src: 00:00:00_00:00:00 (00:00:00:00:00:00), Dst: 00:00:00_00:00:00 (00:00:00:00:00:00)
Internet Protocol Version 4, Src: 127.0.0.1, Dst: 127.0.0.1
Transmission Control Protocol, Src Port: 46960, Dst Port: 8004, Seq: 776, Ack: 2744, Len: 27
Transport Layer Security
    TLSv1.3 Record Layer: Application Data Protocol: Application Data
        Opaque Type: Application Data (23)
        Version: TLS 1.2 (0x0303)
        Length: 22
        Encrypted Application Data: bc1e84bc08f3592c744b086ed5a0006640ed4c85c299

No.     Time           Source                Destination           Protocol Length Info
   2286 1005.520987214 127.0.0.1             127.0.0.1             TLSv1.3  104    Application Data

Frame 2286: 104 bytes on wire (832 bits), 104 bytes captured (832 bits) on interface lo, id 0
Ethernet II, Src: 00:00:00_00:00:00 (00:00:00:00:00:00), Dst: 00:00:00_00:00:00 (00:00:00:00:00:00)
Internet Protocol Version 4, Src: 127.0.0.1, Dst: 127.0.0.1
Transmission Control Protocol, Src Port: 8004, Dst Port: 46960, Seq: 2744, Ack: 803, Len: 38
Transport Layer Security
    TLSv1.3 Record Layer: Application Data Protocol: Application Data
        Opaque Type: Application Data (23)
        Version: TLS 1.2 (0x0303)
        Length: 33
        Encrypted Application Data: 966b77bec58733326d84cabdc717d0161fc60e7361154cbb…

No.     Time           Source                Destination           Protocol Length Info
   2287 1005.520996503 127.0.0.1             127.0.0.1             TCP      66     46960 → 8004 [ACK] Seq=803 Ack=2782 Win=65536 Len=0 TSval=4128213122 TSecr=4128213122

Frame 2287: 66 bytes on wire (528 bits), 66 bytes captured (528 bits) on interface lo, id 0
Ethernet II, Src: 00:00:00_00:00:00 (00:00:00:00:00:00), Dst: 00:00:00_00:00:00 (00:00:00:00:00:00)
Internet Protocol Version 4, Src: 127.0.0.1, Dst: 127.0.0.1
Transmission Control Protocol, Src Port: 46960, Dst Port: 8004, Seq: 803, Ack: 2782, Len: 0

No.     Time           Source                Destination           Protocol Length Info
   2312 1013.057288019 127.0.0.1             127.0.0.1             TLSv1.3  89     Application Data

Frame 2312: 89 bytes on wire (712 bits), 89 bytes captured (712 bits) on interface lo, id 0
Ethernet II, Src: 00:00:00_00:00:00 (00:00:00:00:00:00), Dst: 00:00:00_00:00:00 (00:00:00:00:00:00)
Internet Protocol Version 4, Src: 127.0.0.1, Dst: 127.0.0.1
Transmission Control Protocol, Src Port: 46960, Dst Port: 8004, Seq: 803, Ack: 2782, Len: 23
Transport Layer Security
    TLSv1.3 Record Layer: Application Data Protocol: Application Data
        Opaque Type: Application Data (23)
        Version: TLS 1.2 (0x0303)
        Length: 18
        Encrypted Application Data: f5495858b504c451edf009ab66ce3466c86b

No.     Time           Source                Destination           Protocol Length Info
   2313 1013.057494511 127.0.0.1             127.0.0.1             TLSv1.3  109    Application Data

Frame 2313: 109 bytes on wire (872 bits), 109 bytes captured (872 bits) on interface lo, id 0
Ethernet II, Src: 00:00:00_00:00:00 (00:00:00:00:00:00), Dst: 00:00:00_00:00:00 (00:00:00:00:00:00)
Internet Protocol Version 4, Src: 127.0.0.1, Dst: 127.0.0.1
Transmission Control Protocol, Src Port: 8004, Dst Port: 46960, Seq: 2782, Ack: 826, Len: 43
Transport Layer Security
    TLSv1.3 Record Layer: Application Data Protocol: Application Data
        Opaque Type: Application Data (23)
        Version: TLS 1.2 (0x0303)
        Length: 38
        Encrypted Application Data: 840e8131bf0bd41d4574c2be0faeead2c365fbdc465e11a3…

No.     Time           Source                Destination           Protocol Length Info
   2314 1013.057508783 127.0.0.1             127.0.0.1             TCP      66     46960 → 8004 [ACK] Seq=826 Ack=2825 Win=65536 Len=0 TSval=4128220659 TSecr=4128220659

Frame 2314: 66 bytes on wire (528 bits), 66 bytes captured (528 bits) on interface lo, id 0
Ethernet II, Src: 00:00:00_00:00:00 (00:00:00:00:00:00), Dst: 00:00:00_00:00:00 (00:00:00:00:00:00)
Internet Protocol Version 4, Src: 127.0.0.1, Dst: 127.0.0.1
Transmission Control Protocol, Src Port: 46960, Dst Port: 8004, Seq: 826, Ack: 2825, Len: 0

No.     Time           Source                Destination           Protocol Length Info
   2315 1016.999276812 127.0.0.1             127.0.0.1             TLSv1.3  91     Application Data

Frame 2315: 91 bytes on wire (728 bits), 91 bytes captured (728 bits) on interface lo, id 0
Ethernet II, Src: 00:00:00_00:00:00 (00:00:00:00:00:00), Dst: 00:00:00_00:00:00 (00:00:00:00:00:00)
Internet Protocol Version 4, Src: 127.0.0.1, Dst: 127.0.0.1
Transmission Control Protocol, Src Port: 46960, Dst Port: 8004, Seq: 826, Ack: 2825, Len: 25
Transport Layer Security
    TLSv1.3 Record Layer: Application Data Protocol: Application Data
        Opaque Type: Application Data (23)
        Version: TLS 1.2 (0x0303)
        Length: 20
        Encrypted Application Data: 619b420a97a1cf6819cbadcf121fc95690d216a9

No.     Time           Source                Destination           Protocol Length Info
   2316 1016.999471713 127.0.0.1             127.0.0.1             TLSv1.3  100    Application Data

Frame 2316: 100 bytes on wire (800 bits), 100 bytes captured (800 bits) on interface lo, id 0
Ethernet II, Src: 00:00:00_00:00:00 (00:00:00:00:00:00), Dst: 00:00:00_00:00:00 (00:00:00:00:00:00)
Internet Protocol Version 4, Src: 127.0.0.1, Dst: 127.0.0.1
Transmission Control Protocol, Src Port: 8004, Dst Port: 46960, Seq: 2825, Ack: 851, Len: 34
Transport Layer Security
    TLSv1.3 Record Layer: Application Data Protocol: Application Data
        Opaque Type: Application Data (23)
        Version: TLS 1.2 (0x0303)
        Length: 29
        Encrypted Application Data: dba394e874e244a782cc952fc1e4d55ea28970070c31ce1e…

No.     Time           Source                Destination           Protocol Length Info
   2317 1016.999480484 127.0.0.1             127.0.0.1             TCP      66     46960 → 8004 [ACK] Seq=851 Ack=2859 Win=65536 Len=0 TSval=4128224601 TSecr=4128224601

Frame 2317: 66 bytes on wire (528 bits), 66 bytes captured (528 bits) on interface lo, id 0
Ethernet II, Src: 00:00:00_00:00:00 (00:00:00:00:00:00), Dst: 00:00:00_00:00:00 (00:00:00:00:00:00)
Internet Protocol Version 4, Src: 127.0.0.1, Dst: 127.0.0.1
Transmission Control Protocol, Src Port: 46960, Dst Port: 8004, Seq: 851, Ack: 2859, Len: 0

No.     Time           Source                Destination           Protocol Length Info
   2348 1026.442274357 127.0.0.1             127.0.0.1             TLSv1.3  89     Application Data

Frame 2348: 89 bytes on wire (712 bits), 89 bytes captured (712 bits) on interface lo, id 0
Ethernet II, Src: 00:00:00_00:00:00 (00:00:00:00:00:00), Dst: 00:00:00_00:00:00 (00:00:00:00:00:00)
Internet Protocol Version 4, Src: 127.0.0.1, Dst: 127.0.0.1
Transmission Control Protocol, Src Port: 46960, Dst Port: 8004, Seq: 851, Ack: 2859, Len: 23
Transport Layer Security
    TLSv1.3 Record Layer: Application Data Protocol: Application Data
        Opaque Type: Application Data (23)
        Version: TLS 1.2 (0x0303)
        Length: 18
        Encrypted Application Data: 09761ec964efd6cd1ebb54ba080711e0670e

No.     Time           Source                Destination           Protocol Length Info
   2349 1026.442431840 127.0.0.1             127.0.0.1             TLSv1.3  109    Application Data

Frame 2349: 109 bytes on wire (872 bits), 109 bytes captured (872 bits) on interface lo, id 0
Ethernet II, Src: 00:00:00_00:00:00 (00:00:00:00:00:00), Dst: 00:00:00_00:00:00 (00:00:00:00:00:00)
Internet Protocol Version 4, Src: 127.0.0.1, Dst: 127.0.0.1
Transmission Control Protocol, Src Port: 8004, Dst Port: 46960, Seq: 2859, Ack: 874, Len: 43
Transport Layer Security
    TLSv1.3 Record Layer: Application Data Protocol: Application Data
        Opaque Type: Application Data (23)
        Version: TLS 1.2 (0x0303)
        Length: 38
        Encrypted Application Data: 7e1282bf5d644b90b8b41e0e650480f00a2a2697e73d4e03…

No.     Time           Source                Destination           Protocol Length Info
   2350 1026.442440349 127.0.0.1             127.0.0.1             TCP      66     46960 → 8004 [ACK] Seq=874 Ack=2902 Win=65536 Len=0 TSval=4128234044 TSecr=4128234044

Frame 2350: 66 bytes on wire (528 bits), 66 bytes captured (528 bits) on interface lo, id 0
Ethernet II, Src: 00:00:00_00:00:00 (00:00:00:00:00:00), Dst: 00:00:00_00:00:00 (00:00:00:00:00:00)
Internet Protocol Version 4, Src: 127.0.0.1, Dst: 127.0.0.1
Transmission Control Protocol, Src Port: 46960, Dst Port: 8004, Seq: 874, Ack: 2902, Len: 0

No.     Time           Source                Destination           Protocol Length Info
   2365 1028.868461420 127.0.0.1             127.0.0.1             TLSv1.3  90     Application Data

Frame 2365: 90 bytes on wire (720 bits), 90 bytes captured (720 bits) on interface lo, id 0
Ethernet II, Src: 00:00:00_00:00:00 (00:00:00:00:00:00), Dst: 00:00:00_00:00:00 (00:00:00:00:00:00)
Internet Protocol Version 4, Src: 127.0.0.1, Dst: 127.0.0.1
Transmission Control Protocol, Src Port: 46960, Dst Port: 8004, Seq: 874, Ack: 2902, Len: 24
Transport Layer Security
    TLSv1.3 Record Layer: Application Data Protocol: Application Data
        Opaque Type: Application Data (23)
        Version: TLS 1.2 (0x0303)
        Length: 19
        Encrypted Application Data: 52e41cdf35c0fd04add9bc4d4ea737613b6636

No.     Time           Source                Destination           Protocol Length Info
   2366 1028.868736285 127.0.0.1             127.0.0.1             TLSv1.3  111    Application Data

Frame 2366: 111 bytes on wire (888 bits), 111 bytes captured (888 bits) on interface lo, id 0
Ethernet II, Src: 00:00:00_00:00:00 (00:00:00:00:00:00), Dst: 00:00:00_00:00:00 (00:00:00:00:00:00)
Internet Protocol Version 4, Src: 127.0.0.1, Dst: 127.0.0.1
Transmission Control Protocol, Src Port: 8004, Dst Port: 46960, Seq: 2902, Ack: 898, Len: 45
Transport Layer Security
    TLSv1.3 Record Layer: Application Data Protocol: Application Data
        Opaque Type: Application Data (23)
        Version: TLS 1.2 (0x0303)
        Length: 40
        Encrypted Application Data: 74152ba3b6af7bcb879c7ec0ade3969dd324bd6a555b14b7…

No.     Time           Source                Destination           Protocol Length Info
   2367 1028.868749633 127.0.0.1             127.0.0.1             TCP      66     46960 → 8004 [ACK] Seq=898 Ack=2947 Win=65536 Len=0 TSval=4128236470 TSecr=4128236470

Frame 2367: 66 bytes on wire (528 bits), 66 bytes captured (528 bits) on interface lo, id 0
Ethernet II, Src: 00:00:00_00:00:00 (00:00:00:00:00:00), Dst: 00:00:00_00:00:00 (00:00:00:00:00:00)
Internet Protocol Version 4, Src: 127.0.0.1, Dst: 127.0.0.1
Transmission Control Protocol, Src Port: 46960, Dst Port: 8004, Seq: 898, Ack: 2947, Len: 0

No.     Time           Source                Destination           Protocol Length Info
   2424 1064.002287952 127.0.0.1             127.0.0.1             TLSv1.3  89     Application Data

Frame 2424: 89 bytes on wire (712 bits), 89 bytes captured (712 bits) on interface lo, id 0
Ethernet II, Src: 00:00:00_00:00:00 (00:00:00:00:00:00), Dst: 00:00:00_00:00:00 (00:00:00:00:00:00)
Internet Protocol Version 4, Src: 127.0.0.1, Dst: 127.0.0.1
Transmission Control Protocol, Src Port: 46960, Dst Port: 8004, Seq: 898, Ack: 2947, Len: 23
Transport Layer Security
    TLSv1.3 Record Layer: Application Data Protocol: Application Data
        Opaque Type: Application Data (23)
        Version: TLS 1.2 (0x0303)
        Length: 18
        Encrypted Application Data: 1f2a5fd81426b72e9488173a01ddac8e8207

No.     Time           Source                Destination           Protocol Length Info
   2425 1064.002537861 127.0.0.1             127.0.0.1             TLSv1.3  354    Application Data

Frame 2425: 354 bytes on wire (2832 bits), 354 bytes captured (2832 bits) on interface lo, id 0
Ethernet II, Src: 00:00:00_00:00:00 (00:00:00:00:00:00), Dst: 00:00:00_00:00:00 (00:00:00:00:00:00)
Internet Protocol Version 4, Src: 127.0.0.1, Dst: 127.0.0.1
Transmission Control Protocol, Src Port: 8004, Dst Port: 46960, Seq: 2947, Ack: 921, Len: 288
Transport Layer Security
    TLSv1.3 Record Layer: Application Data Protocol: Application Data
        Opaque Type: Application Data (23)
        Version: TLS 1.2 (0x0303)
        Length: 283
        Encrypted Application Data: 1424c6c20cf83c0c4f95a02d7503486a7334b79061657965…

No.     Time           Source                Destination           Protocol Length Info
   2426 1064.002546769 127.0.0.1             127.0.0.1             TCP      66     46960 → 8004 [ACK] Seq=921 Ack=3235 Win=65280 Len=0 TSval=4128271604 TSecr=4128271604

Frame 2426: 66 bytes on wire (528 bits), 66 bytes captured (528 bits) on interface lo, id 0
Ethernet II, Src: 00:00:00_00:00:00 (00:00:00:00:00:00), Dst: 00:00:00_00:00:00 (00:00:00:00:00:00)
Internet Protocol Version 4, Src: 127.0.0.1, Dst: 127.0.0.1
Transmission Control Protocol, Src Port: 46960, Dst Port: 8004, Seq: 921, Ack: 3235, Len: 0

No.     Time           Source                Destination           Protocol Length Info
   2511 1100.481413936 127.0.0.1             127.0.0.1             TLSv1.3  89     Application Data

Frame 2511: 89 bytes on wire (712 bits), 89 bytes captured (712 bits) on interface lo, id 0
Ethernet II, Src: 00:00:00_00:00:00 (00:00:00:00:00:00), Dst: 00:00:00_00:00:00 (00:00:00:00:00:00)
Internet Protocol Version 4, Src: 127.0.0.1, Dst: 127.0.0.1
Transmission Control Protocol, Src Port: 46960, Dst Port: 8004, Seq: 921, Ack: 3235, Len: 23
Transport Layer Security
    TLSv1.3 Record Layer: Application Data Protocol: Application Data
        Opaque Type: Application Data (23)
        Version: TLS 1.2 (0x0303)
        Length: 18
        Encrypted Application Data: a3146adc966f7bd5caf4afe8e3697b40f315

No.     Time           Source                Destination           Protocol Length Info
   2512 1100.481579693 127.0.0.1             127.0.0.1             TLSv1.3  445    Application Data

Frame 2512: 445 bytes on wire (3560 bits), 445 bytes captured (3560 bits) on interface lo, id 0
Ethernet II, Src: 00:00:00_00:00:00 (00:00:00:00:00:00), Dst: 00:00:00_00:00:00 (00:00:00:00:00:00)
Internet Protocol Version 4, Src: 127.0.0.1, Dst: 127.0.0.1
Transmission Control Protocol, Src Port: 8004, Dst Port: 46960, Seq: 3235, Ack: 944, Len: 379
Transport Layer Security
